supplier_sku,name,unmatched_positions,PrintArea,PriceLines
LL9431,Glimmer Square Glow Cable,Digital Backing Card: ,Laser Engraved: 20 x 20mm (LxH) (rounded corners); Screenprint: Pouch - 30 x 120mm (LxH); Digital Backing Card: 40 x 160mm (LxH),1 Pos Laser Engraved | 2 Pos Laser Engraved | LL9432 PVC Glow Cable Pouch | LL9432 PVC Glow Cable Pouch 1 Col Print | LL9432 PVC Glow Cable Pouch Digital Backing Card | Variable Data - Laser Engraved
LL9434,Kinetic Round Glow Cable,Digital Print Backing Card: ,Laser Engraved: 26 x 13mm (LxH) (see line drawing); Screenprint: Pouch - 30 x 120 (LxH); Digital Print Backing Card: 40 x 160 (LxH),1 Pos Laser Engraved | 2 Pos Laser Engraved | LL9432 PVC Glow Cable Pouch | LL9432 PVC Glow Cable Pouch 1 Col Print | LL9432 PVC Glow Cable Pouch Digital Print Backing Card | Variable Data - Laser Engraved
LL9435,Kinetic Square Glow Cable,Digital Print Backing Card: ,Laser Engraved: 20 x 20mm (LxH) (see line drawing); Screenprint: Pouch - 30 x 120 (LxH); Digital Print Backing Card: 40 x 160 (LxH),1 Pos Laser Engraved | 2 Pos Laser Engraved | LL9432 PVC Glow Cable Pouch | LL9432 PVC Glow Cable Pouch 1 Col Print | LL9432 PVC Glow Cable Pouch Digital Print Backing Card | Variable Data - Laser Engraved
LL9503,Paramount Wall Charger,Box Sleeve: Box Sleeve,Pad Print: 35mm x 25mm (LxW); Digital Print: 35mm x 25mm (LxW); Box Sleeve: Box Sleeve - 169mm x 61.5mm (LxH),1 Pos Pad Print Per Colour | 1 Pos Digital Print | Digital Sleeve on Box
LL9600,Swivel USB Flash Drive,Digital Print: Top,"Laser Engraved: Top - 25 x 14mm (LxH); Digital Print: Top - 25 x 14mm (LxH),  Backing Card - A6 - 148.5 x 105mm (LxH), Card - 100 x 75mm (LxH)",1 Pos Laser Engraved | 2 Pos Laser Engraved | 1 Pos Digital Print | 2 Pos Digital Print | Variable Data - Digital Print or Laser Engrave with ID Label | 1 Pos Digital Print on Backing Card (148.5 x 105) | 2 Pos Digital Print on Backing Card (148.5 x 105)
LL9602,Bamboo USB Flash Drive,Digital Print: Top,"Pad Print: Top - 25 x 11mm (LxH); Digital Print: Top - 35 x 11mm (LxH); Laser Engraved: Top - 25 x 11mm (LxH); Digital Backing Card: A6 Card - 148.5 x 105mm (LxH),  Card - 100 x 75mm (LxH)",1 Col 1 Pos Print | 1 Col 2 Pos Print | 1 Pos Digital Print | 2 Pos Digital Print | 1 Pos Laser Engraved | 2 Pos Laser Engraved | 1 Pos Digital Print on Backing Card - (148.5 x 105) | 2 Pos Digital Print on Backing Card - (148.5 x 105) | Variable Data - Digital Print or Laser Engrave with ID Label
LL9605,Credit Card Flash Drive,Digital Print: Front/Black,"Pad Print: Front/Back (Beside USB Lid) - 40 x 40mm (LxH),  Front (Over USB Lid) - 50 x 40mm (LxH); Digital Print: Front/Black - 85 x 54mm (LxH); Digital Print Backing Card: A6 - Card 148.5 x 105mm (LxH),  Card - 100  x 75mm (LxH)",1 Pos Pad Print Per Colour | 2 Pos Pad Print Per Colour | 1 Pos Digital Print | 2 Pos Digital Print | Variable Data - Digital Print with ID Label | 1 Pos Digital Print on Backing Card | 2 Pos Digital Print on Backing Card
LL9607,Swivel USB Flash Drive Dual 8GB,Digital Print: Top,"Laser Engraved: Top - 25 x 14mm (LxH); Digital Print: Top - 25 x 14mm (LxH),  Backing Card - A6 - 148.5 x 105mm (LxH), Card - 100 x 75mm (LxH)",1 Pos Digital Print | 2 Pos Digital Print | 1 Pos Laser Engraved | 2 Pos Laser Engraved | Variable Data - Digital Print or Laser Engrave with ID Label | 1 Pos Digital Print on Backing Card - (148.5 x 105) | 2 Pos Digital Print on Backing Card - (148.5 x 105)
LL9631,Stow Organiser,Digital Transfer: Strap End; Digital Transfer: Opposite End to Strap,"Digital Transfer: Strap End - 50mm x 50mm (LxW),  Opposite End to Strap - 150mm x 150mm (LxW))",1 Pos Digital Transfer - Small | 1 Pos Digital Transfer - Large | Variable Data - Digital Transfer
LL9777,Press Ready Transfers,Digital Transfer: ,Digital Transfer: 910 x 580mm (LxW),Price Per Sheet
