supplier_sku,name,unmatched_positions,PrintArea,PriceLines
LL6957,Amore 750ml Bottle - Free Flow Lid,Rotary Screen Print: ,"Rotary Screen Print: 200 x 150mm (LxH); Laser Engrave: 40 x 80mm (LxH); Digital Print: 30 x 90mm (LxW),  Box Sleeve - 320 x 264mm (LxH); Rotary Digital Print: 230 x 170mm (LxH)",1 Col Rotary Screen Print | 1 Pos Laser Engrave | 1 Pos Digital Print | Rotary Digital Print | Rotary Digital Print - Gloss | Variable Data - Digital Print or Laser Engrave with ID Label on Box | Variable Data - Rotary Digital Print with ID Label on Box | Digital Sleeve on Box
LL6963,Mystique 950ml Stainless Steel Vacuum Bottle,Rotary Screen Print: ,"Laser Engraved: 32 x 90mm (LxH); Digital Print: 30 x 155mm (LxH),  Sleeve - 402 x 256 (LxH); Rotary Digital Print: Full Wrap - 285mm x 160mm (LxH); Rotary Screen Print: 260mm x 130mm (LxW)",1 Col Rotary Screen Print | 1 Pos Laser Engrave | 1 Pos Digital Print | Rotary Digital Print | Rotary Digital Print - Gloss | Variable Data - Digital Print or Laser Engrave with ID Label on Box | Variable Data - Rotary Digital Print with ID Label on Box | Digital Sleeve on Box
LL7041,Montana RPET Gusset Tote Bag,Digital Transfer: Small; Digital Transfer: Large,"Screenprint: 290 x 320mm (LxH); Digital Transfer: Small - 140 x 45mm (LxH),  Large - 210 x 297mm (LxH)",1 Col 1 Pos Print | 1 Col 2 Pos Print | 1 Pos Digital Transfer - Sml | 2 Pos Digital Transfer - Sml | 1 Pos Digital Transfer - Lrg | 2 Pos Digital Transfer - Lrg | Variable Data - Digital Transfer
LL8038,Blast Fan,Screen Print: Fan Blade Front; Screen Print: Fan Blade Back (White Only),"Screen Print: Fan Blade Front - 120mm Diameter,  Fan Blade Back (White Only) - 120mm Diameter; Digital Label: 90mm Diameter",1 Col 1 Pos Print | 2 Col 1 Pos Print | 1 Pos Digital Label
LL8206,Bamboo A4 Clipboard,Screen Print: Front/Back; Pad Print: Front/Back,Screen Print: Front/Back - 170mm x 150mm (LxW); Laser Engrave: Front/Back - 100 x 100mm (LxW); Pad Print: Front/Back - 55mm x 55mm (LxW),1 Col 1 Pos Pad Print | 1 Col 2 Pos Pad Print | 1 Col 1 Pos Screen Print | 1 Col 2 Pos Screen Print | 1 Pos Laser Engrave | 2 Pos Laser Engrave
LL8231,The Classic Pairing,Custom Gift Box Sleeve: ; Digital Print: Customisable Card,Laser Engrave: Cheeseboard - 45 x 10mm (LxW); Custom Gift Box Sleeve: 190.5 x 730mm (LxW); Label: Mailing Carton - 120mm Diameter; Screen Print: Gift Box - 290 x 150mm (LxW); Digital Print: Customisable Card - 138 x 95mm (LxH),"The Classic Pairing | Digital Sleeve on Gift Box | 1 Pos Laser Engrave on Serving Board | 1 Pos Label on Mailing Carton | 1 Col 1 Pos Screen Print on Gift Box | Customisable Card | Variable Data - Label, Laser Engrave or Digital Sleeve with ID Label on Shipping Box"
LL8233,The Warm Welcome,Digital Sleeve: ; Digital Print: Customisable Card,"Screen Print: Front of Candle - 50 x 50mm (LxW),  Gift Box - 290 x 150mm (LxW); Pad Print: Mug - 45 x 45mm (LxH); Digital Sleeve: 190.5 x 730mm (LxW); Label: Mailing Box - 120mm Diameter; Digital Print: Customisable Card - 138 x 95mm (LxH)","The Warm Welcome | 1 Pos Print on Each Coffee Mug Per Colour | Digital Sleeve on Gift Box | 1 Col 1 Pos Screen Print on Front of Candle | 1 Pos Label on Mailing Carton | 1 Col 1 Pos Screen Print on Gift Box | Customisable Card | Variable Data - Customisable Card, Label or Digital Sleeve with ID Label on Shipping Box"
LL8235,Large Magnetic Gift Box,Digital Sleeve: ,Digital Sleeve: 190.5 x 730mm (LxH); Screen Print: 290 x 150mm (LxH),Digital Sleeve on Box | 1 Col 1 Pos Screen Print
LL8239,The Line Edit Acacia Serving Board,Digital Sleeve: ,Laser Engrave: 45 x 10mm (WxH); Digital Sleeve: 362 x 86mm (WxH),1 Pos Laser Engrave | Digital Sleeve on Serving Board | Variable Data - Laser Engrave or Digital Sleeve
LL8294,Espresso Coffee Cup and Speaker Pack,Screen Print: Lunch Box Front; Screen Print: Lunch Box Lid,"Pad Print: Coffee Mug - 45 x 45mm (LxH); Screenprint: Lunch Box Front - 130 x 70mm (LxH),  Lunch Box Lid - 130 x 80mm (LxH); Digital Transfer: Cooler Bag Front - 100 x 70mm (LxH); Digital Print: Speaker - Grill - 70mmDia; Laser Engraved: Speaker - Side - 20mmDia","3 Pos Print (1 Pad, 1 Digital, 1 Digital Transfer) | 1 Col Print on Coffee Cup | 1 Pos Laser Engraved on Speaker | 1 Pos Digital Print on Speaker | 1 Col Print on Bag | Digital Transfer on Bag | Variable Data on Speaker or Cooler Bag with ID Label"
LL8295,Active Living Pack,Pad Print: Protein Shaker; Digital Label: Front,"Screenprint: Dry Bag - 170 x 120mm (LxH),  Lunch Box - 185 x 185 x 70mm (LxHxD),  Protein Shaker - 70 x 70mm (LxH),  Chill Towel - 100 x 100mm (LxH) , 250 x 80mm (LxH); Digital Print: Lunch Box - 150 x 145mm (LxH); Pad Print: Protein Shaker - 50 x 40mm (LxH); Digital Label: Front - 90mm Diameter, 138 x 50mm (LxH)",4 Pos Screen Print | 1 Col Print on Dry Bag | 1 Col Print on Lunch Box | 1 Pos Digital Print on Lunch Box | 1 Col Screen on Protein Shaker | 1 Col Print on Chill Towel | 1 Pos Digital Label on Chill Towel Pouch | Variable Data on Chill Towel or Lunch Box with ID Label
LL8297,Tradeshow Pack,Digital Transfer: Front/Back; Digital Transfer: Front/Back,"Screenprint: Bag - 290 x 320mm (LxH),  Notebook - 110 x 180mm (LxH); Digital Print: Hand Sanitiser - 30 x 55mm (LxH),  Notebook - 100 x 150mm (LxH); Digital Label: Hand Sanitiser -  30 x 55mm (LxH); Pad Print: Hand Sanitiser - 27 x 50mm (LxH),  Pen - 50 x 7mm (LxH); Laser Engraved: Pen - 50 x 6mm (LxH); Digital Transfer: Front/Back - 297 x 210mm (LxH) - Lrg,  Front/Back - 200 x 250mm (LxH) - Sml","4 Pos Print (1 Screen + 1 Laser + 1 Label + 1 DIgital Print) | 1 Col 1 Pos Print Bag | 1 Pos Digital Transfer - Sml | 1 Pos Digital Transfer - Lrg | 1 Pos Screen Print Per Colour on Notebook | 1 Pos Digital Print Notebook | 1 Pos Digital Label Hand Sanitiser | 1 Pos Digital Print Hand Sanitiser | 1 Pos Pad Print Hand Sanitiser | 1 Pos Pad Print Per Colour Pen | 1 Pos Laser Engraved Pen | Variable Data on Bag, Hand Sanitiser, Notebook or Pen with ID Label"
LL8298,Tradie Pack,Screen Print: Silicone Band,"Screenprint: Cooler Bag - 130 x 70mm (LxH),  Stubby Cooler - 70 x 70mm (LxH),  Silicone Band - 220 x 38mm (LxH); Digital Transfer: Cooler Bag - 100 x 70mm (LxH),  Stubby Cooler - 50 x 50mm (LxH); Pad Print: Bottle Opener - 20 x 12mm (LxH); Laser Engraved: Bottle Opener - 20 x 12mm (LxH)","1 Pos Print (2 x Digital Transfer, 1 x Pad Print, 1 Screen) | 1 Col Print on Cooler Bag | 1 Pos Digital Transfer on Cooler Bag | 1 Col 1 Pos Print Stubby Cooler | 1 Pos Digital Transfer Stubby Cooler | 1 Col 1 Pos Screenprint on Cup | 1 Col 1 Pos Print Bottle Opener | 1 Pos Laser Engraved Bottle Opener | Variable Data on Cooler Bag, Stubby Cooler or on Keytag"
LL8313,The Happy Hour,Digital Sleeve: ; Digital Print: Customisable Card,Digital Sleeve: 190.5 x 730mm (LxW); Digital Transfer: Straw Pouch - 140 x 45mm (LxW); Laser Engrave: Glasses - 26 x 6mm (WxH); Label: Mailing Box - 120mm Diameter; Screen Print: Gift Box - 290 x 150mm (LxW); Digital Print: Customisable Card - 138 x 95mm (LxH),The Happy Hour | Digital Sleeve on Gift Box | Digital Transfer on Straw Pouches (2 x Calico Pouches) | Laser Engrave on Glasses (2 x Glasses) | 1 Pos Label on Mailing Carton | 1 Col 1 Pos Screen Print on Gift Box | Customisable Card
LL8315,The Host Edit,Digital Sleeve: ; Digital Print: Customisable Card,"Digital Sleeve: 190.5 x 730mm (LxW); Laser Engrave: Cheeseboard - 45 x 10mm (LxW); Screen Print: Front of Candle - 50 x 50mm (LxW),  Gift Box - 290 x 150mm (LxW); Label: Mailing Box - 120mm Diameter; Digital Print: Customisable Card - 138 x 95mm (LxH),  Candle Lid - 55mm Diameter","The Host Edit | Digital Sleeve on Gift Box | 1 Col 1 Pos Print on Front of Candle | 1 Pos Laser Engrave on Serving Board | 1 Pos Digital Print on Lid on Candle | 1 Pos Label on Mailing Carton | 1 Col 1 Pos Screen Print on Gift Box | Customisable Card | Variable Data - Customisable Card, Label, Digital Print, Laser Engrave or Digital Sleeve with ID Label on Shipping Box"
LL8319,The Nibble Set,Digital Sleeve: ; Digital Print: Customisable Card,Digital Sleeve: 190.5 x 730mm (LxW); Laser Engrave: Cheeseboard - 45 x 10mm (LxW); Label: Mailing Box - 120mm Diameter; Screen Print: Gift Box - 290 x 150mm (LxW); Digital Print: Customisable Card - 138 x 95mm (LxH),"The Nibble Set | Digital Sleeve on Gift Box | 1 Pos Laser Engrave on Serving Board | 1 Pos Label on Mailing Carton | 1 Col 1 Pos Screen Print on Gift Box | Customisable Card | Variable Data - Customisable Card, Label, Laser Engrave or Digital Sleeve with ID Label on Shipping Box"
LL8327,The Chandon Escape,Laser Engrave: Cheeseboard,"Digital Transfer: Cooler Bag Pouch - 110mm x 70mm (LxH); Laser Engrave: Cheeseboard - 45 x 10mm (LxH),  Glass - 28mmL x 8mmH; Digital Print: Customisable Card - 138 x 95mm (LxH); Label: Mailing Carton - 120mm Diameter; Imitation Etch: Glass - 28mmL x 10mmH","The Chandon Escape | Digital Transfer on Front of Cooler Pocket | Imitation Etch on Glasses - (2 Glasses) | Laser Engrave on Glasses - (2 Glasses) | 1 Pos Laser Engrave on Serving Board | 1 Pos Label on Mailing Carton | Customisable Card | Variable Data - Customisable Card, Digital Transfer, Label or Laser Engrave with ID Label on Shipping Box"
LL8329,The Sunchaser Set,Digital Label: Customisable Card,"Digital Transfer: Bag - 297 x 210mm (LxW),  Bag Pouch - 120 x 50mm (LxW),  Pickleball Pouch - 150 x 150mm (LxW); Laser Engrave: Cheeseboard - 45 x 10mm (LxH); Digital Label: Bat - 150mm Diameter,  Mailing Carton - 120mm Diameter,  Customisable Card - 138 x 95mm (LxH)","The Sunchaser Set | Digital Transfer on Tote Bag | 1 Pos Digital Transfer on Tote Pouch | 1 Pos Laser Engrave on Serving Board | 1 Pos Digital Transfer on Pickleball Pouch | 1 Pos Digital Label on  Bat from Pickleball Set | Customisable Card | 1 Pos Label on Mailing Carton | Variable Data - Customisable Card, Digital Transfer, Label or Laser Engrave with ID Label on Shipping Box"
LL8331,Glow & Graze,Digital Sleeve: ,"Digital Sleeve: 190.5 x 730mm (LxW); Laser Engrave: Cheeseboard - 45 x 10mm (LxH); Screen Print: Front of Candle - 50 x 50mm (LxW),  Gift Box - 290 x 150mm (LxW); Label: Mailing Box - 120mm Diameter,  Customisable Card - 138 x 95mm (LxH)","Glow & Graze | Digital Sleeve on Gift Box | 1 Col 1 Pos Print on Front of Candle | 1 Pos Laser Engrave on Serving Board | 1 Pos Label on Mailing Carton | 1 Col 1 Pos Screen Print on Gift Box | Customisable Card | Variable Data - Customisable Card, Label, Laser Engrave or Digital Sleeve with ID Label on Shipping Box"
LL8339,The Brew Ritual,Digital Sleeve: ; Digital Print: Customisable Card,"Screen Print: Front of Candle - 50 x 50mm (LxW),  Gift Box - 290 x 150mm (LxW); Pad Print: Mug - 45 x 45mm (LxH); Digital Sleeve: 190.5 x 730mm (LxW); Label: Mailing Box - 120mm Diameter; Digital Print: Customisable Card - 148 x 105mm (LxH)","The Brew Ritual | Digital Sleeve on Gift Box | 1 Col 1 Pos Screen Print on Front of Candle | 1 Pos Label on Mailing Carton | 1 Pos Pad Print Per Colour on Mug | 1 Col 1 Pos Screen Print on Gift Box | Customisable Card | Variable Data - Customisable Card, Label or Digital Sleeve with ID Label on Shipping Box"
LL8341,The Refined Graze,Laser Engrave: Cheeseboard,"Digital Transfer: Cooler Bag Pouch - 110mm x 70mm (LxH); Laser Engrave: Cheeseboard - 45 x 10mm (LxH),  Glass - 28mmL x 8mmH; Digital Print: Customisable Card - 138 x 95mm (LxH); Label: Mailing Carton - 120mm Diameter; Imitation Etch: Glass - 28mmL x 10mmH","The Refined Graze | Digital Transfer on Front of Cooler Pocket | Imitation Etch on Glasses - (2 Glasses) | Laser Engrave on Glasses - (2 Glasses) | 1 Pos Laser Engrave on Serving Board | 1 Pos Label on Mailing Carton | Customisable Card | Variable Data - Customisable Card, Label or Laser Engrave with ID Label on Shipping Box"
LL8351,The Pause Pack,Digital Print: Customisable Card,"Digital Transfer: Cooler Bag - 130 x 140mm (LxH); Digital Print: Cup - 30mm x 70mm (LxH),  Customisable Card - 138 x 95mm (LxH); Label: Mailing Carton - 120mm Diameter","The Pause Pack | Digital Transfer Transfer on Cooler Bag | Customisable Card | 1 Pos Digital Print on Cup | 1 Pos Label on Mailing Carton | Variable Data - Customisable Card, Digital Transfer, Label or Digital Print with ID Label on Shipping Box | 2 Pos Print (1xDigital Transfer, 1 x Customisable Card)"
LL8353,The Classic Whisky Gift Set,Custom Gift Box Sleeve: ,"Custom Gift Box Sleeve: 190.5 x 730mm (LxW); Label: Mailing Carton - 120mm Diameter,  Customisable Card - 138 x 95mm (LxH); Screen Print: Gift Box - 290 x 150mm (LxW); Laser Engrave: Glasses - 26 x 6mm (WxH)","The Classic Whisky Gift Set | Digital Sleeve on Gift Box | 1 Pos Label on Mailing Carton | Laser Engrave on Glasses (2 x Glasses) | 1 Col 1 Pos Screen Print on Gift Box | Customisable Card | Variable Data - Customisable Card, Label, Laser Engrave or Digital Sleeve with ID Label on Shipping Box"
LL8363,The Generous Host,Digital Sleeve: ; Digital Print: Customisable Card,"Digital Sleeve: 190.5 x 730mm (LxW); Laser Engrave: Cheeseboard - 45 x 10mm (LxW); Screen Print: Front of Candle - 50 x 50mm (LxW),  Gift Box - 290 x 150mm (LxW); Label: Mailing Box - 120mm Diameter; Digital Print: Customisable Card - 138 x 95mm (LxH),  Candle Lid - 55mm Diameter","The Generous Host | Digital Sleeve on Gift Box | 1 Col 1 Pos Print on Front of Candle | 1 Pos Laser Engrave on Serving Board | 1 Pos Digital Print on Lid on Candle | 1 Pos Label on Mailing Carton | 1 Col 1 Pos Screen Print on Gift Box | Customisable Card | Variable Data - Customisable Card, Label, Digital Print, Laser Engrave or Digital Sleeve with ID Label on Shipping Box | 2 Pos Print (1 x Digital Sleeve, 1 x Screen Print)"
LL8383,The Happy Pup Pack,Digital Print: Customisable Card,"Digital Transfer: Wet Bag - 210 x 285mm (LxH),  Dog Toy - Front/Back - 70 x 70mm (LxH); Digital Print: Waste Bag Dispenser - 25 x 20mm (LxH),  Bottle - 30 x 50mm (LxH),  Customisable Card - 138 x 95mm (LxH); Laser Engrave: Brush -Bristles Side/Pins Side - 55 x 14mm (LxH),  Bottle - Inside of Bowl - 15 x 40mm (LxH); Screen Print: Wet Bag - 230 x 180mm (LxH),  Bowl - 70mm Diameter","The Happy Pup Pack | 6 Pos Print (2 x Screen, 2 x Digital, 1 x Transfer, 1 x Laser) | 1 Col 1 Pos Print on Bag | 1 Pos Digital Transfer - Large on Bag | 1 Pos Digital Print on Waste Dispenser | 1 Pos Digital Print on Bottle | 1 Pos Laser Engrave on Bottle | 1 Pos Laser Engrave on Brush | 1 Pos Screen Print on Bowl | 1 Pos Digital Transfer on Tug Toy | Variable Data - Digital Transfer, Customisable Card, Label, Digital Print, Laser Engrave or Digital Sleeve with ID Label on Shipping Box"
LL8391,The Perfect Pairing,Custom Gift Box Sleeve: ; Digital Print: Customisable Card,Custom Gift Box Sleeve: 190.5 x 730mm (LxW); Digital Print: Customisable Card - 138 x 95mm (LxW); Screen Print: Gift Box - 290 x 150mm (LxW); Label: Mailing Box - 120mm Diameter,The Perfect Pairing | Digital Sleeve on Gift Box | 1 Col 1 Pos Screen Print on Gift Box | Customisable Card | 1 Pos Label on Mailing Carton | 1 Pos Digital Sleeve
LL8747,Thor Protein Shaker / Storage Cup,Screen Print: ,Pad Print: 50 x 40mm (LxH); Screenprint: 70 x 70mm (LxH),1 Col 1 Pos Pad Print | 1 Col 1 Pos Screenprint
LL8798,Banquet Cutlery Set in Calico Pouch,Laser Engrave: Cutlery,Screenprint: Pouch - 45 x 140mm (LxH); Laser Engraved: Cutlery - 50 x 5mm (LxH); Digital Transfer: Pouch - 45 x 140mm (LxH),1 Col 1 Pos Print | 1 Col 2 Pos Print | 1 Pos Digital Transfer | 2 Pos Digital Transfer | 3 Position Laser on Cutlery | Variable Data - Digital Transfer or Laser Engrave with ID Label
LL8800,Banquet Stainless Steel Cutlery & Straw Set in Calico Pouch,Laser Engrave: Cutlery; Laser Engrave: Straws - Base,"Screenprint: Pouch - 45 x 140mm (LxH); Laser Engraved: Cutlery - 50 x 5mm (LxH),  Straws - Base - 50 x 3mm (LxH) Top - 35 x 3mm (LxH); Digital Transfer: Pouch - 45 x 140mm (LxH)",1 Col 1 Pos Print on Pouch | 1 Col 2 Pos Print on Pouch | Digital Transfer 1 Pos Pouch | Digital Transfer 2 Pos Pouch | Laser Engraved on Cutlery - 3 Pos | Laser Engraved on Straws - 2 Pos | Variable Data - Digital Transfer or Laser Engrave with ID Label
LL8808,Savour Cutlery Set in Pouch,Laser Engrave: Cutlery,Screenprint: Pouch - 45 x 140mm (LxH); Digital Transfer: Pouch - 45 x 140mm (LxH); Laser Engraved: Cutlery - 50 x 5mm (LxH),1 Col 1 Pos Print on Pouch | 1 Col 2 Pos Print on Pouch | 1 Pos Digital Transfer Pouch | 2 Pos Digital Transfer Pouch | 3 Position Laser on Cutlery | Variable Data - Digital Transfer or Laser Engrave with ID Label
LL88120,Coco Plush Teddy Bear,Screen Print: Front,Screen Print: Front - 70 x 45mm (LxH); Digital Transfer: Front - 60 x 60mm (LxH),1 Col 1 Pos Print on T-Shirt | Digital Transfer on T-Shirt | Custom Colour T-Shirt 1 Col 1 Pos Print | Custom Colour T-Shirt 2 Col 1 Pos Print | Variable Data - Digital Transfer
LL88125,Coconut Plush Teddy Bear,Screen Print: Front,Screen Print: Front - 70 x 45mm (LxH); Digital Transfer: Front - 60 x 60mm (LxH),1 Col 1 Pos Print on T-Shirt | Digital Transfer on T-Shirt | Custom Colour T-Shirt 1 Col 1 Pos Print | Custom Colour T-Shirt 2 Col 1 Pos Print | Variable Data - Digital Transfer
LL88306,Korporate Koala,Screen Print: Front,Screen Print: Front - 70 x 45mm (LxH); Digital Transfer: Front - 60 x 60mm (LxH),1 Col 1 Pos Print on T-Shirt | Digital Transfer on T-Shirt | Custom Colour T-Shirt 1 Col 1 Pos Print | Custom Colour T-Shirt 2 Col 1 Pos Print | Variable Data - Digital Transfer
LL9075,Morocco Phone Stand,Digital Print: Larger Side; Digital Print: Smaller Side; Laser Engrave: Larger Side; Laser Engrave: Smaller Side; Pad Print: Larger Side; Pad Print: Smaller Side,"Digital Print: Larger Side - 95 x 25mm (WxH),  Smaller Side - 25 x 25mm (WxH); Laser Engrave: Larger Side - 95 x 25mm (WxH),  Smaller Side - 25 x 25mm (WxH); Pad Print: Larger Side - 50 x 30mm (WxH),  Smaller Side - 20 x 20mm (WxH)",1 Col 1 Pos Pad Print - Sml | 1 Col 1 Pos Pad Print - Lrg | 1 Pos Digital Print - Sml | 1 Pos Digital Print - Lrg | 1 Pos Laser Engrave - Sml | 1 Pos Laser Engrave - Lrg | Variable Data - Digital Print or Laser Engrave
LL9109,"Velocity Power Bank - 2,000 mAh",Digital Print: Power Bank,"Pad Print: Power Bank  - 60 x 13mm (LxH); Laser Engraved: Power Bank - 60 x 13mm (LxH); Digital Print: Power Bank - 80 x 13mm (LxH),  Sleeve - Full coverage,  Case - 60 x 35mm (LxH); Digital Label: Box - 70 x 40mm (LxH),  Box - Full name only for variable data identification - 30 x 55mm (LxH); Screenprint: Case - 60 x 35mm (LxH)","1 Pos Pad Print Per Colour | 1 Pos Laser Engraved | 1 Pos Digital Print | 1 Pos Digital Label on Box | LL9091 3 in 1 Combo Cable | LL6673 Small EVA Case 1 Col 1 Pos | LL6673 Small EVA Case 1 Pos Digital | Variable Data - Digital Print, Digital Sleeve or Label with ID Label on Box | Digital Sleeve on Box"
LL9111,Impulse Power Bank,Digital Print: Power Bank,"Digital Print: Power Bank - 80 x 16mm (LxH),  Case - 60 x 35mm (LxH),  Sleeve - 176 x 97mm (LxH); Pad Print: 60 x 16mm (LxH); Digital Label: Box - 70 x 40mm (LxH),  Box - Full name only for variable data identification - 30 x 55mm (LxH); Screenprint: Case - 60 x 35mm (LxH)",1 Pos Pad Print Per Colour | 1 Pos Digital Print | 1 Pos Digital Label on Box | LL9091 3 in 1 Combo Cable | LL6673 Small EVA Zipper Case | LL6673 Small EVA Zipper Case 1 Col 1 Pos | LL6673 Small EVA Zipper Case 1 Pos Digital | Variable Data - Digital Print or Digital Sleeve with ID Label on Box | Digital Sleeve on Box
LL9136,Aussie Recycled Flyer,Screen Print: Top,Screenprint: Top - 140mm Diameter; Digital Print: Top - 140mm Diameter,1 Col 1 Pos Print | 2 Col 1 Pos Print | 1 Pos Digital Print | Variable Data - Digital Print with ID Label
LL9138,Frequent Flyer,Screen Print: Top,Screen Print: Top - 140mm Diameter; Digital Print: Top - 140mm Diameter,1 Col 1 Pos Print | 2 Col 1 Pos Print | 1 Pos Digital Print | Variable Data - Digital Print with ID Label
LL9205,Dynamo Wireless Power Bank,Digital Print: Standard Power Bank,"Digital Print: Standard Power Bank - 70 x 50mm (LxH),  Edge to Edge Power Bank - 115 x 68mm (LxH),  Case - 60 x 50mm (LxH),  Sleeve - Full coverage; Pad Print: Power Bank - 50 x 50mm (LxH); Screenprint: Case - 100 x 50mm (LxH); Digital Label: Box - 90 x 45mm (LxH),  Box - Full name only for variable data identification - 30 x 55mm (LxH)",1 Pos Pad Print Per Colour | 1 Pos Digital Print | 1 Pos Digital Print - Edge to Edge | LL9091 3 in 1 Combo USB Cable | 1 Pos Digital Label on Box | LL6674 Medium EVA Case 1 Col 1 Pos | LL6674 Medium EVA Case 1 Pos Digital | Digital Sleeve on Box | Variable Data - Digital Print or Digital Sleeve with ID Label on Box
LL9209,Sabre Wireless Power Bank,Digital Print: Standard Power Bank,"Pad Print: Power Bank - 50 x 50mm (LxH); Digital Print: Standard Power Bank - 70 x 50mm (LxH),  Edge to Edge Power Bank -  136 x 71mm (LxH),  Box Sleeve - Full coverage,  Case - 60 x 50mm (LxH); Digital Label: Box - 90 x 45mm (LxH),  Box - Full name only for variable data identification - 30 x 55mm (LxH); Screenprint: Power Bank - 70 x 50mm (LxH),  Case - 100 x 50mm (LxH)","1 Pos Pad Print Per Colour | 1 Pos Digital Print | 1 Pos Digital Print - Edge to Edge | 1 Pos Digital Label on Box | Digital Sleeve on Box | LL6674 Medium EVA Case 1 Col 1 Pos | LL6674 Medium EVA Case 1 Pos Digital | Variable Data - Digital Print, Digital Sleeve or Label with ID Label on Box"
LL9211,Sabre Eco Wireless Power Bank,Pad Print: Power Bank; Digital Print: Standard Power Bank,"Pad Print: Power Bank - 60 x 50mm (LxH); Digital Print: Standard Power Bank - 70 x 50mm (LxH),  Edge to Edge Power Bank - 150 x 71mm (LxH),  Box Sleeve - 226 x 154mm (LxH); Digital Label: Box - 90 x 45mm (LxH),  Box - Full name only for variable data identification - 30 x 55mm (LxH)","1 Pos Pad Print Per Colour | 1 Pos Digital Print | 1 Pos Digital Print - Edge to Edge | 1 Pos Digital Label on Box | Digital Sleeve on Box | LL6674 Medium EVA Zipper Case 1 Col 1 Pos Print | LL6674 Medium EVA Zipper Case 1 Pos Digital | Variable Data - Digital Print, Digital Sleeve or Label with ID Label on Box"
LL9213,"Octavius 8,000mAh Power Bank",Digital Print: Power Bank,"Pad Print: Power Bank - 60 x 40mm (LxH); Digital Print: Power Bank - 80 x 40mm (LxH),  Sleeve - Full coverage ,  Case  - 60 x 50mm (LxH); Laser Engraved: Power Bank - 80 x 40mm (LxH); Digital Label: Box  - 90 x 45mm (LxH),  Box - Full name only for variable data identification - 30 x 55mm (LxH); Screenprint: Case - 100 x 50mm (LxH)","1 Pos Pad Print Per Colour | Laser Engraved 1 Pos | 1 Pos Digital Print | 1 Pos Digital Label on Box | Digital Sleeve on Box | LL6674 Medium EVA Zipper Case 1 Col 1 Pos | LL6674 Medium EVA Zipper Case 1 Pos Digital | Variable Data - Digital Print, Digital Sleeve, Label or Laser Engravewith ID Label"
LL9215,"Arya 5,000mAh Power Bank",Digital Print: Power Bank,"Digital Print: Power Bank - 70 x 40mm (LxH),  LL6674 Front/Back - 60 x 50mm (LxH),  Sleeve - 179 x 115mm (LxH); Pad Print: Power Bank - 60 x 50mm (LxH); Screenprint: LL6674 Front/Back - 100 x 50mm (LxH); Digital Label: Box - 70 x 40 (LxH),  Box - Full name only for variable data identification - 30 x 55mm (LxH)","1 Pos Pad Print Per Colour | 1 Pos Digital Print | 1 Pos Digital Label on Box | Digital Sleeve on Box | Variable Data - Digital Print, Digital Sleeve or Label with ID Label on Box | LL6674 Medium EVA Case 1 Col 1 Pos | LL6674 Medium EVA Case 1 Pos Digital"
LL9216,Leopard Power Bank,Label: Box,Digital Print: Front - 100mm x 50mm (LxW); Pad Print: Front 50mm x 50mm (LxW); Laser: Front - 100mm x 50mm (LxW); Label: Box - 50mm x 50mm (LxW),1 Pos Pad Print Per Colour | 1 Pos Digital Print | 1 Pos Laser Engrave | 1 Pos Digital Label on Box | Variable Data - Digital Print or Laser Engrave with ID Label on Box
LL9217,Ortega Power Bank,Label: Box,"Digital Print: Top - 100 x 50mm (LxW),  Box Sleeve - 299mm x 150mm (LxH); Pad Print: Top - 50 x 50mm (LxW); Laser Engrave: Top - 100 x 50mm (LxW); Label: Box - 50 x 50mm (LxW)","1 Pos Pad Print Per Colour | 1 Pos Digital Print | 1 Pos Laser Engrave | Variable Data - Digital Print, Laser Engrave or Digital Sleeve with ID Label on Box | Digital Sleeve on Box"
LL9242,Hyper Bluetooth Headphones in EVA Zipper Case,Pad Print: Ear Muff,Pad Print: Ear Muff - 50mm Diameter; Digital Print: Ear Muff - 50mm Diameter; Screen Print: EVA Case - 40 x 60mm (LxW),1 Col 1 Pos Print | 1 Col 2 Pos Print | 1 Pos Digital Print | 2 Pos Digital Print | EVA Zipper Case 1 Col 1 Pos Print | Variable Data - Digital Print with ID Label
LL9268,Halo Phone Grip & Stand,Digital Print: ,"Digital Print: 19mmDia; Pad Print: 19mmDia; Digital Backing Card: A6 Card - 148.5 x 105mm (LxH),  Card - 100 x 75mm (LxH)",1 Col 1 Pos Print | 1 Pos Digital Print | Variable Data - Digital Print with ID Label | 1 Pos Digital Print on Backing Card | 2 Pos Digital Print on Backing Card
LL9355,Shield Data Blocker,Digital Print: Top,"Laser Engraved: Top - 24 x 11mm (LxH); Digital Print: Top - 24 x 11mm (LxH),  Backing Card - 100 x 75mm (LxH)",1 Pos Laser Engraved | 1 Pos Digital Print | 1 Pos Digital Print on Backing Card | 2 Pos Digital Print on Backing Card | Variable Data - Digital Print or Laser Engraved with ID Label
LL9404,Family Light Up  3 in 1 Cable,Digital Print: Front; Pad Print: LL6673 Case,"Digital Print: Front - 25 x 20mm (LxH) (with rounded corners),  LL6673 Case - 60 x 35mm (LxH); Pad Print: LL6673 Case - 60 x 35mm (LxH)",1 Pos Digital Print | LL6673 Small EVA Zipper Case1 Col 1 Pos | LL6673 Small EVA Zipper Case 1 Pos Digital | Variable Data - Digital Print with ID Label
LL9430,Glimmer Round Glow Cable,Digital Print Backing Card: ,Laser Engraved: 26 x 13mm (LxH) (see line drawing); Screenprint: Pouch - 30 x 120 (LxH); Digital Print Backing Card: 40 x 160 (LxH),1 Pos Laser Engraved | 2 Pos Laser Engraved | LL9432 PVC Glow Cable Pouch | LL9432 PVC Glow Cable Pouch 1 Col Print | LL9432 PVC Glow Cable Pouch Digital Print Backing Card | Variable Data - Laser Engraved
